{
  "schemaVersion": "chimpmaera.verification/evidence-dag/v2",
  "graphId": "verification-fabric-shadow",
  "graphVersion": 9,
  "environment": {
    "node": "24.14.1",
    "os": "linux",
    "architecture": "x86_64",
    "packageManager": "npm@11.16.0"
  },
  "hardGates": [
    "npm run lint",
    "npm run release-governance:verify",
    "npm run supply-chain:verify",
    "sha256sum -c SHA256SUMS",
    "./scripts/build-public-release.sh --output <isolated-absolute-path>"
  ],
  "nodes": [
    {
      "id": "intake-001-issue-candidate-v1",
      "dependsOn": [
        "vf-contract-v1"
      ],
      "inputs": [
        {
          "path": "packages/contracts/src/issue-candidate.ts",
          "role": "SECURITY",
          "sha256": "3b3afd3616d3f3a29170e3764bb6cc398147051fae5bc33e45057627796c532a"
        },
        {
          "path": "schemas/contracts/issue-candidate-v1.schema.json",
          "role": "SCHEMA",
          "sha256": "e442f491bcbde525603b8bf9d4153758af93889138aedcbf64e0ced8ff6940af"
        },
        {
          "path": "tests/fixtures/issue-candidate/positive-v1.json",
          "role": "FIXTURE",
          "sha256": "e1555582df11358c74e45053e9a0a70b3daf838fbc7870b6f77633f9726cdec3"
        },
        {
          "path": "tests/fixtures/issue-candidate/quarantine-v1.json",
          "role": "FIXTURE",
          "sha256": "6a58ef56d2037c0ad1709c3476373ec1e46bec69e80c07f02db00b367f5e61c9"
        },
        {
          "path": "tests/issue-candidate.test.ts",
          "role": "VALIDATOR",
          "sha256": "a6d92272e7784e7e35d745b52ac38588e9be2d03744386f8055064ade3fb85b7"
        },
        {
          "path": "scripts/render-issue-candidate-evidence.mjs",
          "role": "VALIDATOR",
          "sha256": "f6cd25472abcfe5ab3e44f180b24b5c7b1373547b4463562bd271db04466e807"
        },
        {
          "path": "docs/ISSUE-CANDIDATE-OPERATOR-GUIDE.md",
          "role": "DERIVED_EVIDENCE",
          "sha256": "437ea30db2ea06e6c1eedae3608f56ff99cddd162fef129bd311f5d856c1a081"
        },
        {
          "path": "docs/development/intake-001-issue-46-pdca.md",
          "role": "DERIVED_EVIDENCE",
          "sha256": "8bf623fa2941a4cfb572600cbc9623006419e005a1e2b94cc92d4d729a23ea2c"
        },
        {
          "path": "verification/intake-001-evidence-v1.json",
          "role": "DERIVED_EVIDENCE",
          "sha256": "d43b38be4695e0e5c70e3a8e0ebd2a55b527974d7d9721cc43d94ee248245432"
        }
      ],
      "ownedTests": [
        "npm run issue-candidate:test"
      ],
      "invariants": [
        "Duplicate search and exact owner approval precede one idempotent injected submit and exact readback.",
        "Private, security and sensitive-shaped content emits zero public bytes and routes fail closed.",
        "Uncertain effects cannot be resubmitted and retain immutable recovery identities."
      ],
      "riskClass": "CRITICAL",
      "globalInvalidation": false
    },
    {
      "id": "ccp-m1-contribution-intake-ledger-v1",
      "dependsOn": [],
      "inputs": [
        {
          "path": "packages/contracts/src/contribution-intake-ledger.ts",
          "role": "CONTRACT",
          "sha256": "11b9476d04e89153046596c3fec2f1a12a4e77808be852ddf943ddf8d3528774"
        },
        {
          "path": "packages/contracts/src/canonical-json.ts",
          "role": "SECURITY",
          "sha256": "666513ba9a89c0eae0daa0e0159a262eb4e0aa105971a151a19bac1a9b6c4826"
        },
        {
          "path": "schemas/contracts/contribution-intake-ledger-v1.schema.json",
          "role": "SCHEMA",
          "sha256": "11a04666e84394ab2b29308b7e3d4a2770354421a51fcf5f691b7709fe1cd6cc"
        },
        {
          "path": "tests/contribution-intake-ledger.test.ts",
          "role": "VALIDATOR",
          "sha256": "dba9c35c8cc62b6c656b40b315ed57ed1bd1f4825bdff7b5591374e58f6ee4a3"
        },
        {
          "path": "docs/development/ccp-m1-intake-ledger-slice-pdca.md",
          "role": "DERIVED_EVIDENCE",
          "sha256": "2f0cdc8ef5e739df8f60d0afa7da151aa674d05a2523f19ff01e8fab1343358c"
        }
      ],
      "ownedTests": [
        "npm run contribution-intake:test"
      ],
      "invariants": [
        "Only an explicit prevalidated context can create, verify, classify, ingest or query a contribution ledger.",
        "Verification reconstructs non-authoritative submitted identity evidence and replays every binding, disposition, reason, quarantine, replacement, delivery digest, delivery-id, timestamp and head transition from genesis while every authoritative ledger, entry and receipt identity remains canonically bound to context.",
        "The pure in-memory contract has no transport, persistence, runner, queue, CI-slot, merge or production effect capability."
      ],
      "riskClass": "CRITICAL",
      "globalInvalidation": false
    },
    {
      "id": "vf-contract-v1",
      "dependsOn": [],
      "inputs": [
        {
          "path": "packages/contracts/src/verification-fabric.ts",
          "role": "CONTRACT",
          "sha256": "2e4948641104cbbb496dc5974c33ce823571c12997649bbb1cf7d06e6b0349e1"
        },
        {
          "path": "schemas/contracts/verification-fabric-bundle-v1.schema.json",
          "role": "SCHEMA",
          "sha256": "c5e9e5ff60901523bc6e4014213a9e80728c364204b5a084cc9f5c323db5ab1e"
        },
        {
          "path": "tests/fixtures/verification-fabric/positive-bundle-v1.json",
          "role": "FIXTURE",
          "sha256": "ddcbad4141a13898e105ea4fb7e973341d44749e4c77b22af2bd3171dd10ecef"
        },
        {
          "path": "tests/fixtures/verification-fabric/negative-matrix-v1.json",
          "role": "FIXTURE",
          "sha256": "81036747fea963b72624656b74166d2f9de5b15bfddb071fad717d307b888465"
        },
        {
          "path": "tests/verification-fabric.test.ts",
          "role": "VALIDATOR",
          "sha256": "a9a6cac87fc78bd63dcbd4936edabe0d0b3f7695523294911829461676969212"
        }
      ],
      "ownedTests": [
        "node --test dist/tests/verification-fabric.test.js"
      ],
      "invariants": [
        "V1 evidence and LKG verification remains fail closed.",
        "V2 planning cannot weaken or replace V1 verdict semantics."
      ],
      "riskClass": "HIGH",
      "globalInvalidation": false
    },
    {
      "id": "integration-profile-v1",
      "dependsOn": [
        "vf-contract-v1"
      ],
      "inputs": [
        {
          "path": "packages/contracts/src/integration-profile.ts",
          "role": "CONTRACT",
          "sha256": "eedcd74a342563771646413e82c5cae8dcb8505ef5bfcb79de4f17a8b9c02b10"
        },
        {
          "path": "schemas/contracts/integration-profile-v1.schema.json",
          "role": "SCHEMA",
          "sha256": "66495d4d334d26afaaaf5137147fb7803061c4338ed3de3475770ed4f12a7d68"
        },
        {
          "path": "tests/fixtures/integration-profile/positive-variants-v1.json",
          "role": "FIXTURE",
          "sha256": "9587b83e99ddb076334fbff99b00c851690f0b251ff86f7549c05408d13d021f"
        },
        {
          "path": "tests/fixtures/integration-profile/negative-probes-v1.json",
          "role": "FIXTURE",
          "sha256": "371624fea662e1dc02bfd217aaa57564cc8b47c2a0d4d8ba889751ce85de251e"
        },
        {
          "path": "tests/integration-profile.test.ts",
          "role": "VALIDATOR",
          "sha256": "957f638c0dcf241dcbcc18f7e419d0ee401c50fdb08cb40b8e941ff08b069050"
        },
        {
          "path": "docs/INTEGRATION-PROFILES.md",
          "role": "DERIVED_EVIDENCE",
          "sha256": "8db9e5c9abfa2a222f2c775a6b9531bd8923e86a9fa735e67887705a87ddb763"
        }
      ],
      "ownedTests": [
        "npm run integration-profile:test"
      ],
      "invariants": [
        "Integration profiles remain local-synthetic references and never grant authority or activate a route.",
        "Unknown actions, writes, private paths, unpinned inputs, cross-tenant references, stale evidence, incompatible versions, missing rollback and generic proxies fail closed.",
        "Verification, extension assurance and update behavior remain owned by their existing CM contracts."
      ],
      "riskClass": "HIGH",
      "globalInvalidation": false
    },
    {
      "id": "vf-shadow-v2",
      "dependsOn": [
        "vf-contract-v1"
      ],
      "inputs": [
        {
          "path": "packages/contracts/src/verification-fabric-v2.ts",
          "role": "CONTRACT",
          "sha256": "e673fd892d39fec139af7b6706420dfd23aa8c4f2f5d202a4d9e817259e062d0"
        },
        {
          "path": "schemas/contracts/verification-evidence-dag-v2.schema.json",
          "role": "SCHEMA",
          "sha256": "5286ece3ec3ef1b8619ffa4926a43ebd36b62b9f15169547d9c4a47e3c36f133"
        },
        {
          "path": "schemas/contracts/verification-attestation-v2.schema.json",
          "role": "SCHEMA",
          "sha256": "e469e9775f9fdac08a8b223edcfaf07aa05860bbaef6a11bb3c0b5447d4872b2"
        },
        {
          "path": "scripts/verification-plan.mjs",
          "role": "VALIDATOR",
          "sha256": "0def996c0ff2ea244a792af765af5247dede3084babb02c956dd582dbb453218"
        },
        {
          "path": "scripts/verification-shadow.mjs",
          "role": "VALIDATOR",
          "sha256": "7f24007e2e5db9638d25e5c3c94cef607771798672e46ccf9f81a23f4eeb8ce5"
        },
        {
          "path": "tests/verification-fabric-v2.test.ts",
          "role": "VALIDATOR",
          "sha256": "aee8467acd1c67c7edf338752690677b46b6c34896ca4a2a4f78119495613e98"
        },
        {
          "path": "docs/VERIFICATION-FABRIC-SHADOW.md",
          "role": "DERIVED_EVIDENCE",
          "sha256": "c0c3b7d75fa3254373d768746c6b273564f8cc7036cdfefc96a242e5edaa684f"
        }
      ],
      "ownedTests": [
        "node --test dist/tests/verification-fabric-v2.test.js"
      ],
      "invariants": [
        "Any uncertainty produces FULL_FALLBACK rather than silent omission.",